{
  "$schema": "../../../schema/effect.schema.json",
  "schemaVersion": 1,
  "kind": "omadecor-effect-pack",
  "id": "liixini/circle",
  "name": "Circle Reveal",
  "version": "1.0.0",
  "description": "A softly edged circle that reveals or removes a window.",
  "source": {
    "type": "ported",
    "project": "liixini/shaders",
    "url": "https://github.com/liixini/shaders/tree/238e7c70e317bb0ca0b0366cf0851b8de3ddc969/circle",
    "revision": "238e7c70e317bb0ca0b0366cf0851b8de3ddc969",
    "authors": ["liixini", "gre"],
    "portAuthors": ["OmaDecor contributors"],
    "license": "MIT",
    "adaptationNotes": "Original Niri shader functions are embedded unchanged in an HWS compatibility wrapper."
  },
  "compatibility": {
    "sourceFormat": "niri",
    "events": ["open", "close"]
  },
  "shaders": {
    "open": "open.glsl",
    "close": "close.glsl"
  },
  "requires": [
    "shader.progress",
    "shader.random-seed",
    "shader.window-texture",
    "shader.window-size"
  ],
  "duration": {
    "defaultMs": 650,
    "minMs": 150,
    "maxMs": 2000
  },
  "renderingCost": "low",
  "preview": "preview.gif",
  "parameters": [],
  "presets": {}
}
